CI,Affaire - Assistance,Innovation - Règlementation,Collectif - Individuel,Liberté créative - Cadre,Confort - Effort Physique,Conceptuel - Concrêt ,Thématique/Environnement - Identité/Projet de vie
Travailler à mon compte,-8.75,-3.75,7.5,2.25,nan,nan,6
Travailler seul,nan,nan,10,nan,nan,nan,-8
"Piloter les coûts, la rentabilité",-10,7.75,5.25,7.75,-8.25,nan,-3
Piloter un budget,-7.25,7,6,7.75,-8.25,7.5,-3
Gérer un service de grande entreprise,-9.5,7.5,nan,6.5,-5.5,3.5,8
Gérer une salle de sport,-7,5.75,-2.75,2,nan,7.5,7
Gérer un hôtel,-8.25,nan,-3.25,6.5,nan,7.75,7
Gérer un salon de coiffure,-5.5,3,-0.75,3.5,nan,8,7
Créer un projet entrepreneurial,-9,-6,4,-2.75,3.5,3.25,8
Prendre des risques,nan,-7.5,nan,-8,nan,nan,-5
Vendre ou louer des maisons,-7.5,nan,5,5,nan,6.5,0
"Gérer des actifs, un patrimoine",-8.5,8.5,5.75,5.25,-7.75,nan,4
Piloter des indicateurs statistiques,nan,6,6,2.25,-9,-9,-10
"Etre leader, inspirer et motiver",nan,nan,nan,nan,nan,-5,8
"Organiser une équipe, des tâches",-3.5,1.5,nan,4.75,nan,5.5,-5
"Coacher, faire progresser les autres",6,-6.5,nan,nan,nan,-4,8
Atteindre des objectifs ambitieux,-8.75,nan,nan,nan,nan,nan,6
Accompagner le changement,3,nan,-3.75,-3.5,nan,-4.75,6
Réaliser une veille de marché,-7.25,nan,7,6.25,-7,nan,-5
Concevoir une offre de produits / services,-6.5,-3.25,-1.5,nan,-6.5,nan,-5
Travailler dans l’administration publique,5,6.75,nan,7.5,nan,nan,3
Donner des discours,nan,-7.5,6,-1.75,nan,-3,0
Développer un territoire économique,nan,-1.25,nan,5,-1.75,3,7
"Gérer et entretenir un site, une infrastructure",-6,6,-2.25,6.75,2.5,6.5,-2
"Se déplacer souvent, voyager",nan,nan,6.75,nan,6.5,7.5,5
"Convaincre, influencer",nan,nan,nan,-6,nan,-3,8
"Concevoir des contenus, des supports de communication",-4.75,-7.5,6.75,-6.25,-7.25,nan,-4
Gérer le marketing et piloter l'image de marque,-8.5,-7.25,5.25,-4.25,-6.75,nan,6
"Vendre, commercialiser",-10,-6.25,5.75,3.25,3.75,5.75,8
Servir un client,2,-3.5,5.5,3,nan,6.5,8
Elaborer une stratégie commerciale,-9,-6.25,5.75,-1.75,-6.25,-6.25,-5
Elaborer une offre commerciale / Répondre à un appel d'offre,-9.5,-3.75,4,7,-7.5,-6.5,-5
Gérer la relation client,nan,nan,6,nan,-0.75,4.5,-5
"Améliorer la qualité de service, fidéliser les clients",-3,-3,4.5,nan,-4,-2.25,-3
Animer la communication interne,nan,nan,nan,-3.5,-6.25,3.75,4
"Accueillir, orienter, renseigner",10,nan,nan,5.5,nan,4.25,8
S'occuper de la carrière de quelqu'un,7.5,nan,nan,nan,nan,5.5,8
Ecouter et dialoguer avec ses collaborateurs,4.25,nan,nan,-2.75,-6,1,5
Maintenir l’engagement et la satisfaction des collaborateurs,nan,nan,-5.75,-0.25,-6.25,1.25,5
Travailler en réseau,nan,nan,-8,nan,nan,4.5,-6
Découvrir d'autres cultures,nan,nan,nan,nan,nan,-4.75,10
Travailler en collectif,nan,nan,-10,nan,nan,nan,-10
Travailler dans le secteur social,10,nan,-5.25,6.25,nan,5.75,10
Travailler dans un bureau,nan,nan,nan,nan,-9,nan,-8
Assurer une gestion documentaire,nan,6.75,8.25,8.25,-8.25,5.5,-4
Faire des inventaires et tenir des registres,nan,7,7.5,8.25,nan,8,-8
Commander et gérer le matériel de bureaux,nan,4.25,nan,5.75,-4.25,6.75,-5
Gérer la logistique,nan,7,1.25,8.25,2.25,8.25,-4
Tenir le registre des transactions financières d'une entreprise,nan,9,8,9,-7.25,7.25,-8
Assurer la gestion administrative,nan,8,6.75,7.75,-9,7.5,-5
Calculer le salaire des employés,nan,9.5,7.75,10,-8.75,5.75,-5
Transférer des fonds entre banques,nan,10,nan,10,nan,nan,-3
Elaborer et faire respecter des consignes,nan,10,-3,7.5,-3.5,5,5
Respecter les règles,nan,10,nan,10,nan,6.5,-8
Collecter et classer,nan,8.5,6,8,nan,8,-6
Gérer la comptabilité et les finances,-5.5,10,nan,9.75,-7.25,nan,0
Gérer les finances publiques,nan,10,nan,9.25,-8,nan,0
Protéger les personnes et les biens,8,9.5,nan,7.25,6.5,7.25,10
Juger,nan,nan,7.5,nan,nan,nan,8
Faire respecter les lois,nan,10,nan,9.5,6,7.5,10
Participer à des procès,nan,nan,nan,7.5,nan,nan,-5
Enquêter,nan,-3.25,4,nan,5.5,5,2
Rédiger des contrats,nan,9.5,6.75,8.75,nan,nan,-8
Négocier des contrats,-6.25,6.5,nan,1.5,-3.5,0,-2
Respecter un cadre juridique,nan,9.5,nan,9.75,nan,nan,-10
Assurer un transport,nan,7.5,nan,7.25,nan,8.5,3
Travailler sur des voitures,nan,nan,6,1,6.5,9.25,7
"Réparer, nettoyer, entretenir",nan,nan,7.25,nan,7.25,10,0
Poser du parquet ou du carrelage,nan,nan,5.75,nan,8.25,10,-4
Poser des murs ou des toits,nan,nan,nan,6.75,8.25,10,-4
"Poser, réparer de la plomberie",nan,nan,7,7.25,8.25,10,-4
"Livrer, transporter, conduire, manoeuvrer",nan,6.25,8.75,6.5,8,10,6
Porter ou manipuler des charges lourdes,nan,nan,nan,nan,9.25,9,-8
"Faire un travail physique, fatiguant",nan,nan,nan,nan,10,nan,-8
Réparer et installer des serrures,nan,nan,8.25,7,6.25,10,0
Se rendre sur des chantiers,nan,nan,nan,nan,6.75,8.5,-8
Manipuler des matières premières,nan,nan,nan,6.25,6.5,9.75,-7
"Extraire, exploiter des ressources",nan,nan,nan,3.75,8,7.5,-7
"Conditionner, manutentionner des produits",nan,nan,4,7.75,7.5,10,-8
Réparer des appareils électroménagers,nan,4.75,7,6,7.75,10,-4
Monter des meubles,nan,3.25,nan,7,7.25,8,-4
Maîtriser un savoir faire technique,nan,4.75,8.25,nan,nan,nan,5
Utiliser une machine sur une chaîne de production,nan,7.75,7.75,9.25,6,9,0
Assembler des pièces électroniques,nan,4.75,8.5,8,5.5,9,-6
Assurer la maintenance technique,nan,7.5,8,8.25,6.75,9.25,-4
"Cultiver, récolter",nan,nan,5.5,nan,9.25,9.5,8
Cuisiner,2.5,nan,nan,-3,nan,9.75,8
Travailler dans l'art ou dans la musique,nan,-8.25,nan,-9.5,nan,-4.5,10
"Faire des tâches minutieuses, de précision",nan,nan,8,3.75,nan,9,-6
"Utiliser des machines, des outils, des logiciels",nan,nan,6.75,nan,nan,6.75,-4
"Repérer les erreurs, observer, contrôler",nan,7.75,6.5,7.5,nan,6.75,5
Maîtriser une documentation technique,nan,nan,7.75,6.5,nan,nan,-7
Contrôler la qualité,1,7.25,7.25,8.25,nan,7.25,-4
Gérer les stocks et les approvisionnements,nan,5.75,5.5,7.75,nan,7.5,-4
Travailler de mes mains,nan,nan,nan,nan,6.5,8,8
"Construire, fabriquer",nan,-2.25,nan,nan,8.75,10,8
Entretenir des jardins et des espaces verts,nan,1.25,5,nan,8.5,10,4
Aménager un espace,nan,-0.75,4.25,-5,nan,nan,6
Dessiner,nan,nan,9.5,-8.25,-8.5,nan,10
Ecrire des chansons,nan,-7.25,8.5,-7.75,-9.25,nan,10
"Composer, mettre en scène",nan,-8,nan,-7.75,-3.25,nan,8
"Créer une oeuvre, designer",nan,-8.5,6.75,-8,nan,nan,8
"Faire des illustrations, du graphisme",nan,-7.75,7.75,-6,-7.75,nan,6
Ecrire des scénarios de films ou séries,nan,-6.5,5.5,-6.5,-9,nan,6
"Distraire, animer, divertir",nan,-6.5,nan,-6.25,2.25,-2.5,8
"Chanter, jouer d'un instrument",nan,nan,nan,nan,2,4.75,10
Exercer une activité artistique ou créative,nan,-6.25,6,-8.75,nan,4,8
Travailler dans le spectacle ou pour la télévision,nan,nan,nan,nan,nan,nan,8
"Réaliser une performance, une représentation artistique",nan,-7.25,nan,-7.5,5.5,3.5,10
Diriger une pièce de théâtre,nan,nan,nan,nan,3.75,nan,10
Se déplacer pour faire des reportages,nan,nan,nan,nan,7.25,7.75,4
Avoir des sensations fortes,nan,nan,9.25,nan,nan,nan,8
Jouer un rôle dans une série ou un film,nan,-5,nan,nan,4.75,nan,10
Ecrire des livres,nan,-7.25,9,-9.75,-7.25,nan,10
Traduire,nan,nan,6,nan,-7,nan,8
Développer les relations internationales,nan,nan,nan,nan,nan,-4.25,-4
Pratiquer plusieurs langues,nan,nan,nan,nan,nan,nan,6
Se déplacer en tournées,nan,nan,-8.25,nan,5,7.25,-5
Organiser des sorties pédagogiques avec des personnes handicapées,10,nan,nan,nan,4.75,7.5,6
Apprendre à des personnes handicapées à travailler en autonomie,10,nan,nan,nan,4.5,7.5,8
Favoriser l'insertion professionnelle et sociale des personnes,9.5,nan,nan,nan,nan,0.75,8
Enseigner et éduquer,6.5,4,3,-1,1.25,nan,10
Enseigner dans une école primaire,8,2.25,nan,nan,nan,nan,10
Enseigner à une classe de lycée,7.5,2.75,nan,-1.5,1.25,nan,10
"Aider, conseiller les autres",nan,nan,nan,-2.5,-4.25,2,10
M'occuper de la santé des autres,9,5,nan,6.75,6.5,6.5,10
Travailler pour des associations,7.75,nan,nan,nan,nan,nan,7
Réaliser un accompagnement psychologique,8.25,-0.25,6.5,6.5,0.25,nan,7
Apprendre la lecture à des enfants,9.25,6,nan,6.5,-1.5,nan,8
S'occuper des enfants dans une garderie,9,3.75,nan,7.25,6,7.25,6
Être avec des enfants ou adolescents,7,nan,nan,7.25,4.5,6.75,7
Travailler en magasin,nan,nan,nan,6.5,nan,7.25,5
Travailler au domicile d'un particulier,7.25,nan,6.75,nan,nan,7.75,3
Aider les personnes ayant des problèmes familiaux,10,nan,6.25,nan,3.25,nan,8
Aider les personnes ayant des problèmes d'addiction,10,nan,6,nan,6.25,nan,8
Prendre soin des animaux,9.75,nan,3.25,nan,nan,7.25,10
Protéger l'environnement,nan,5.5,nan,nan,5,6.5,10
Être dans la nature,nan,nan,nan,nan,nan,7.5,0
Etudier le comportement animal,5.25,nan,nan,nan,-2.75,nan,8
Cartographier,nan,7,nan,nan,nan,nan,-4
Etudier des solutions pour réduire la pollution,nan,-4.5,nan,nan,-4.5,nan,6
Faire de la recherche scientifique,nan,-8.25,nan,nan,-5.75,nan,8
Examiner au microscope,nan,nan,8.25,7,nan,nan,-8
"Gérer une architechture logicielle, un système technique",nan,7,nan,6.5,-8,nan,-6
Rechercher et analyser des informations,nan,-0.25,4.75,-1.75,nan,nan,-6
"Travailler avec les nombres, manipuler des données",nan,nan,6.5,3,-8.25,nan,-6
Etudier la génétique,nan,nan,nan,7,-8.5,nan,6
Etudier la structure du corps humain,nan,nan,nan,7,-8.5,nan,-4
Développer des nouveaux traitements médicaux,6.5,nan,nan,nan,-6,nan,7
Etudier le mouvement des planètes,nan,nan,nan,6.5,-8.75,nan,7
"Faire des expériences, des tests",nan,nan,nan,7,-4.5,nan,-4
Développer des programmes informatiques,nan,nan,nan,-0.75,-8.5,3.5,7
Résoudre des énigmes et des problèmes,nan,-5.25,5.25,-4.5,nan,nan,6
Elaborer une feuille de calcul à l'aide d'un logiciel,nan,nan,8.25,6.75,-9.25,6,-8
Modéliser / Prototyper,nan,nan,6.75,-4.75,-2.75,nan,-7
Utiliser les nouvelles technologies,nan,-1,nan,nan,nan,2.5,0
Assurer une veille technologique,nan,nan,6,2.25,nan,nan,-6
